{
  "asset_id": "CHK-SW-HX-07A",
  "event_id": "EVT-U1B-2025-0312",
  "assessment_date": "2025-03-12T09:00:00Z",
  "look_back_window_days": 548,
  "fmea_pm_linkage_available": true,
  "window": {
    "start": "2023-09-01T00:00:00Z",
    "end": "2025-03-12T09:00:00Z"
  },
  "checks": [
    {
      "check_id": "PM-CHK-SW-INTERVAL-NONCONFORMANCE",
      "check_type": "inspection",
      "status": "fail",
      "component_id": "CHK-SW-HX-07A",
      "source_ref": "VND-SPEC-GWB-250",
      "wo_id": "WO-2021-PMREV-04",
      "overdue_by_days": 178,
      "applicable_fm_ids": [
        "FM-PM-FREQ-NONCONF",
        "FM-PM-CONFIG-CONTROL-GAP"
      ],
      "details": "PM task PM-SW-CHK-ANNUAL (check valve lapping and seat inspection) is set to an 18-month interval per plant PM program revision WO-2021-PMREV-04. Vendor specification VND-SPEC-GWB-250 (Section 6.4) requires a 12-month inspection interval for continuous high-cycle service exceeding 500 cycles per year. Plant interval (18 months) exceeds vendor specification (12 months) by 50%. Under the vendor-required schedule, the last inspection (September 2023) should have been followed by another inspection in September 2024, which was not performed. As of event date (2025-03-12), the vendor-spec-based inspection is 178 days overdue. The 2021 PM program revision (WO-2021-PMREV-04) was processed as a minor procedure revision without engineering evaluation of the vendor specification impact and without 50.59 screening."
    },
    {
      "check_id": "PM-CHK-SW-LAST-EXECUTION",
      "check_type": "scheduled_pm",
      "status": "pass",
      "component_id": "CHK-SW-HX-07A",
      "source_ref": "WO-2021-PMREV-04",
      "scheduled_date": "2023-09-15T00:00:00Z",
      "completed_date": "2023-09-15T00:00:00Z",
      "overdue_by_days": 0,
      "details": "Last PM execution (September 2023) was completed on schedule per the plant 18-month interval. Inspection as-found: seat condition acceptable at time of inspection. As-left: acceptable. This pass reflects compliance with the plant nonconforming schedule, not compliance with the vendor specification requirement of 12-month maximum interval."
    },
    {
      "check_id": "PM-CHK-SW-07B-CROSS-TRAIN",
      "check_type": "inspection",
      "status": "fail",
      "component_id": "CHK-SW-HX-07B",
      "source_ref": "VND-SPEC-GWB-250",
      "overdue_by_days": 178,
      "applicable_fm_ids": [
        "FM-PM-FREQ-NONCONF"
      ],
      "details": "Same PM frequency nonconformance applies to Train B cross-train valve CHK-SW-HX-07B (model GWB-250-SS-316). The 18-month plant interval versus 12-month vendor specification applies fleet-wide for this valve model at this plant. Both train A and train B valves are subject to the same governance nonconformance."
    }
  ],
  "overdue_items": [
    {
      "check_id": "PM-CHK-SW-INTERVAL-NONCONFORMANCE",
      "check_type": "inspection",
      "scheduled_date": "2024-09-15T00:00:00Z",
      "overdue_by_days": 178,
      "source_ref": "VND-SPEC-GWB-250"
    }
  ],
  "data_quality_notes": [
    "KG FMEA/PM task linkage available (fmea_pm_linkage_available=true). PM task node PM-SW-CHK-ANNUAL carries both plant_interval_months=18 and vendor_spec_interval_months=12. Governance scorer detects the interval nonconformance and generates FM-PM-FREQ-NONCONF (Category J) candidate.",
    "If vendor_spec_interval_months were absent from the KG PM task node, the Category J candidate would not be generated. This is the KG coverage bound demonstrated in this test case."
  ],
  "summary": {
    "total_checks": 3,
    "passed": 1,
    "failed": 2,
    "unknown": 0,
    "overdue_count": 1,
    "compliance_rate": 0.333,
    "overall_compliance": "partial",
    "maintenance_induced_risk": "high",
    "has_scope_gaps_for_primary_fm": true,
    "data_quality_confidence": "high"
  }
}